{
  "$schema": "http://json-schema.org/draft-07/schema#",
  "$id": "https://api.avoqado.io/contracts/commercial/campaign-v2.schema.json",
  "title": "Avoqado Commercial Campaign Version v2",
  "type": "object",
  "additionalProperties": false,
  "required": [
    "schemaVersion",
    "contractVersion",
    "campaignVersionId",
    "campaignCode",
    "version",
    "status",
    "publishedAt",
    "startsAt",
    "endsAt",
    "stackingGroups",
    "rules"
  ],
  "properties": {
    "schemaVersion": { "const": 2 },
    "contractVersion": { "const": "2.0.0" },
    "campaignVersionId": { "$ref": "#/definitions/id" },
    "campaignCode": { "$ref": "#/definitions/code" },
    "version": { "type": "integer", "minimum": 1 },
    "status": { "enum": ["ACTIVE", "INACTIVE"] },
    "publishedAt": { "$ref": "#/definitions/timestamp" },
    "startsAt": { "$ref": "#/definitions/timestamp" },
    "endsAt": { "$ref": "#/definitions/timestamp" },
    "stackingGroups": { "type": "array", "maxItems": 50, "items": { "$ref": "#/definitions/stackingGroup" } },
    "rules": { "type": "array", "minItems": 1, "maxItems": 100, "items": { "$ref": "#/definitions/rule" } }
  },
  "definitions": {
    "id": { "type": "string", "minLength": 1, "maxLength": 128 },
    "code": { "type": "string", "pattern": "^[A-Z][A-Z0-9_]{1,63}$" },
    "money": { "type": "string", "pattern": "^(0|[1-9][0-9]{0,16})\\.[0-9]{2}$" },
    "timestamp": {
      "type": "string",
      "format": "date-time",
      "pattern": "^[0-9]{4}-[0-9]{2}-[0-9]{2}T[0-9]{2}:[0-9]{2}:[0-9]{2}\\.[0-9]{3}Z$"
    },
    "target": {
      "type": "object",
      "additionalProperties": false,
      "minProperties": 1,
      "properties": {
        "productCodes": { "type": "array", "minItems": 1, "items": { "$ref": "#/definitions/code" } },
        "productKinds": { "type": "array", "minItems": 1, "items": { "enum": ["PLAN", "POS", "MODULE"] } },
        "bundleCodes": { "type": "array", "minItems": 1, "items": { "$ref": "#/definitions/code" } }
      }
    },
    "rule": {
      "type": "object",
      "additionalProperties": false,
      "required": ["code", "type", "priority", "target", "cycles"],
      "properties": {
        "code": { "$ref": "#/definitions/code" },
        "type": { "enum": ["FIXED_PRICE", "PERCENT_OFF", "AMOUNT_OFF", "FREE_PERIOD", "BUNDLE_PRICE"] },
        "priority": { "type": "integer", "minimum": -10000, "maximum": 10000 },
        "target": { "$ref": "#/definitions/target" },
        "cycles": { "type": "integer", "minimum": 1, "maximum": 120 },
        "amount": { "$ref": "#/definitions/money" },
        "percentBasisPoints": { "type": "integer", "minimum": 1, "maximum": 10000 }
      },
      "allOf": [
        {
          "if": { "properties": { "type": { "enum": ["FIXED_PRICE", "AMOUNT_OFF", "BUNDLE_PRICE"] } }, "required": ["type"] },
          "then": { "required": ["amount"], "not": { "required": ["percentBasisPoints"] } }
        },
        {
          "if": { "properties": { "type": { "const": "PERCENT_OFF" } }, "required": ["type"] },
          "then": { "required": ["percentBasisPoints"], "not": { "required": ["amount"] } }
        },
        {
          "if": { "properties": { "type": { "const": "FREE_PERIOD" } }, "required": ["type"] },
          "then": { "not": { "anyOf": [{ "required": ["amount"] }, { "required": ["percentBasisPoints"] }] } }
        }
      ]
    },
    "stackingStep": {
      "type": "object",
      "additionalProperties": false,
      "required": ["position", "ruleCode"],
      "properties": {
        "position": { "type": "integer", "minimum": 1, "maximum": 10 },
        "ruleCode": { "$ref": "#/definitions/code" }
      }
    },
    "stackingGroup": {
      "type": "object",
      "additionalProperties": false,
      "required": ["code", "steps"],
      "properties": {
        "code": { "$ref": "#/definitions/code" },
        "steps": { "type": "array", "minItems": 2, "maxItems": 10, "items": { "$ref": "#/definitions/stackingStep" } }
      }
    }
  }
}
